{
  "protocol_version": "1.0",
  "message_id": "msg-0001",
  "session_id": "session-demo",
  "channel": "handoffs",
  "kind": "data",
  "source": "architect",
  "target": "coder",
  "sequence": 1,
  "created_at": "2026-01-01T00:00:00Z",
  "deadline": "2026-01-01T00:05:00Z",
  "correlation_id": "run-demo",
  "causation_id": null,
  "idempotency_key": "handoff-architect-coder-1",
  "attempt": 1,
  "requires_ack": true,
  "payload_type": "handoff_state",
  "payload": {
    "task": "Build a calculator CLI",
    "from_agent": "architect",
    "to_agent": "coder",
    "summary": "Architecture approved.",
    "decisions": ["Use argparse"],
    "important_files": ["calculator.py"],
    "errors": [],
    "next_steps": ["Implement commands"],
    "context_refs": [],
    "metadata": {}
  },
  "metadata": {
    "trace_enabled": true
  }
}
